{
  "$schema": "http://json-schema.org/draft-04/schema#",
  "type": "object",
  "properties": {
    "_id": {"type": "string"},
    "created_at": {"$ref": "#/definitions/isoDate"},
    "description": {"type": "string"},
    "label": {"type": "string"},
    "scheme_id": {
      "type": "string",
      "enum": ["ds", "dq", "di", "dt"]
    },
    "terms": {
      "type": "array",
      "items": {
        "type": "object",
        "properties": {
          "abbreviation": {"type": "string"},
          "definition": {"type": "string"},
          "label": {"type": "string"},
          "name": {"type": "string"}
        },
        "required": ["label"]
      }
    }
  },
  "definitions": {
    "objectId": {
      "type": "string",
      "pattern": "^[a-fA-F0-9]{24}$",
      "maxLength": 24
    },
    "isoDate": {
      "type": "string", 
      "pattern": "^[0-9]{4}-[0-9]{2}-[0-9]{2}[T][0-9]{2}:[0-9]{2}:[0-9]{2}|.|[0-9]{0,3}Z$"
    }
  },
  "required": ["label", "scheme_id"],
  "additionalProperties": false
}