{
  "_id": "ds-variable",
  "description": "TBD",
  "label": "Variable",
  "scheme_id": "ds",
  "terms": [
    {
      "definition": "TBD",
      "label": "BarometricPressure",
      "name": "Barometric Pressure"
    },
    {
      "definition": "TBD",
      "label": "Count"
    },
    {
      "definition": "TBD",
      "label": "Depth"
    },
    {
      "definition": "TBD",
      "label": "Description"
    },
    {
      "definition": "TBD",
      "label": "DielectricStrength",
      "name": "Dielectric Strength"
    },
    {
      "definition": "TBD",
      "label": "Direction"
    },
    {
      "definition": "TBD",
      "label": "Discharge"
    },
    {
      "definition": "TBD",
      "label": "Duration"
    },
    {
      "definition": "TBD",
      "label": "Evapotranspiration"
    },
    {
      "definition": "TBD",
      "label": "Flux"
    },
    {
      "definition": "TBD",
      "label": "Height"
    },
    {
      "definition": "TBD",
      "label": "Moisture"
    },
    {
      "definition": "TBD",
      "label": "PhotosyntheticallyActiveRadiation",
      "name": "Photosynthetically Active Radiation"
    },
    {
      "definition": "TBD",
      "label": "Precipitation"
    },
    {
      "definition": "TBD",
      "label": "RelativeHumidity",
      "name": "Relative Humidity"
    },
    {
      "definition": "TBD",
      "label": "SolarRadiation",
      "name": "Solar Radiation"
    },
    {
      "definition": "TBD",
      "label": "Speed"
    },
    {
      "definition": "TBD",
      "label": "Temperature"
    },
    {
      "definition": "TBD",
      "label": "Transpiration"
    },
    {
      "definition": "TBD",
      "label": "Turbidity"
    },
    {
      "definition": "TBD",
      "label": "VaporPressure"
    },
    {
      "definition": "TBD",
      "label": "VaporPressureDeficit",
      "name": "Vapor Pressure Deficit"
    },
    {
      "definition": "TBD",
      "label": "Velocity"
    },
    {
      "definition": "TBD",
      "label": "Visibility"
    },
    {
      "definition": "TBD",
      "label": "Volume"
    },
    {
      "definition": "TBD",
      "label": "VolumetricWaterContent",
      "name": "Volumetric Water Content"
    }
  ]
}