{
  "_id": "ds-aggregate",
  "created_at": "2016-11-15T16:30:00Z",
  "description": "TBD",
  "label": "Aggregate",
  "scheme_id": "ds",
  "terms": [
    {
      "definition": "TBD",
      "label": "Average"
    },
    {
      "definition": "TBD",
      "label": "Maximum"
    },
    {
      "definition": "TBD",
      "label": "Median"
    },
    {
      "definition": "TBD",
      "label": "Minimum"
    },
    {
      "definition": "TBD",
      "label": "StandardDeviation"
    },
    {
      "definition": "TBD",
      "label": "Sum"
    }
  ]
}